title,Rating,maincateg,actprice1
DOCTOR EXTRA SOFT Flat Ortho Care Diabetic Orthopaedic Comfort Dr Slippers and Flipflops For Women's and Girl's Slippers,4.1,Women,599
Men Multicolor Sandal,3.8,Men,998
"Running Shoe, Gym, Walking Daily Wear Running Shoes For Men  (Orange)",4,Men,999
"Women Black, Pink Wedges Sandal",3.7,Women,799
CLAIRE (Collector's Edition) Running Shoes For Women  (Purple),4.4,Women,1299
Perfect Stylish Girls Casual Shoes Sneakers For Women  (Pink),4.3,Women,884
Men Black Sandal,4,Men,1899
Hybrid Astro Running Shoes For Men  (Black),4.2,Men,10999
Men Tan Sandal,3.1,Men,2495
Women Black Flats Sandal,4,Women,999
Men SFG-541 Black Slippers,4,Men,349
"Women Tan, Tan Flats Sandal",3.8,Women,499
Women Off White Wedges Sandal,4.2,Women,999
Flip Flops,4.3,Women,799
Lace Up For Men  (Black),3.9,Men,1099
Laces Jutis For Women Bellies For Women  (Yellow),4,Women,699
JUTTI102PINK Jutis For Women  (Pink),3.6,Women,542
Women Silver Heels Sandal,4.1,Women,1099
"Women Navy, Beige Sports Sandal",4.3,Women,3795
Slides,3.7,Men,499
Lace Up For Men  (Black),4.2,Men,2799
Men's Formal Leather Shoes Slip On For Men  (White),4.1,,1999
Ethnic Mule For Women  (Pink),4.3,Women,499
Bellies For Women  (Gold),3.6,Women,799
Slides,3.7,Men,998
Women Tan Wedges Sandal,3.8,Women,2541
Women Tan Heels Sandal,3.7,Women,999
Women Multicolor Flats Sandal,4,Women,580
Puma Unisex's Cappela Idp Peacoat-Rhubarb White Sneakers,4.2,Women,1979
Comfortable Indoor/Outdoor Soft Bottom Fur Slippers |Womens Flipflop |Womens Fish Slippers |Girls Slippers flip Flop Slides,4.3,Women,999
S Buckle Women's Ankle Lenght Black Boots For Women  (Black),3.7,Women,499
Boots For Women  (Red),4.3,Women,999
Sneakers For Men  (White),3.9,Men,699
Premium Quality Boots For Men  (Black),4.1,Men,999
Jutis For Women  (Multicolor),5,Women,2195
Stylish Boots For Women  (Pink),4,Women,999
Rocking Long Boots For Men  (Black),4,Men,499
Men's Cream Wedding & Sherwani Rhinestone Ruby jutis Party Wear For Men  (Off White),4,Men,999
PRO-CAP-AW1017 Lace Up For Men  (Brown),4,Men,1499
Mojaris For Men  (Brown),5,Men,2199
Women Black Wedges Sandal,4.1,Women,1995
Women Gold Heels Sandal,3.9,Women,999
Men's Brown Leather Ethnic Heart Design M ojari Mojaris For Men  (Brown),3.8,Men,999
Boys Casual Stylish Synthetic Leather Boots For Men  (Tan),4,Men,1070
"Combo Pack of 2 Casual Shoes Loafers For Men  (Brown, Black)",3.9,Men,998
Men Grey Sandal,3.7,Men,999
Women Red Sports Sandal,3.6,Women,499
Women Beige Heels Sandal,3.9,Women,999
Slippers,3.9,Men,999
White Casual Shoes Sneakers For Men  (White),4.1,Men,999
"Women Black, Blue Wedges Sandal",3.9,Women,899
SFG-2080 Slippers,4.1,Men,574
Go Walk Lite - Charming Casuals For Women  (Purple),4.4,Women,4999
Flip Flops,3.8,Men,799
Men's Black ankle lenght High Tops For Men  (Navy),4,Men,999
Men Blue Sports Sandal,4.3,Men,4195
"ENVY - MISSTEP Running Shoes For Women  (Black, Grey)",4.5,Women,4499
Flip Flops,4.2,Women,999
Training & Gym Shoes For Women  (Pink),4.4,Women,4499
Flip Flops,4.3,Men,1799
Velvet ethnic Juti Casuals For Women  (Multicolor),3.8,Women,499
Relax Sports Running Shoes For Men  (Grey),4.1,Men,895
Liberty Women Black Heels,0,Women,999
Chappal for men | New fashion latest design casual slippers for boys stylish | 4711 thong sandals grey chappals for men | Perfect flip flops for daily wear walking Slippers,3.9,Men,499
"Latest Collection, Comfortable & Fashionable Bellies for Women's and Girl's Pack of 2 Bellies For Women  (Multicolor)",4.1,Women,999
Classical Formal Full Black/Brown Strong Pure Leather Shoes For Mens/Boys Mojaris For Men  (Brown),3.7,Men,499
"W Flex Experience Rn 7 Running Shoes For Women  (White, Grey)",4.4,Women,5295
Lightweight Pack Of 1 Trendy Sneakers Sneakers Sneakers For Men  (Red),4,Men,599
Men Synthetic Leather Chappal (Camel) Flip Flops,3.8,Men,900
Casuals For Men  (Black),,Men,999
Men Tan Flats Sandal,3.5,Men,799
Jutis For Women  (Brown),3.9,Women,699
Jutis For Women  (Pink),3.9,Women,599
Boots For Men  (Brown),4.1,Men,3895
Women Grey Wedges Sandal,4.4,Women,1099
Slip On For Men  (Black),4,Men,1799
"Rocky Boots For Men Boots For Men  (Tan, Beige)",4.2,Men,1299
Slippers,4.4,Women,1199
Flip Flops,4.1,Women,599
Women Blue Wedges Sandal,3.7,Women,599
Women Multicolor Flats Sandal,4,Women,999
Women Copper Wedges Sandal,4,Women,500
Basket Heart Patent Wn s Sneakers For Women  (White),4.2,Women,5999
Ladies Multi Punjabi Jutti Ethnic Mojari Handmade Rajasthani Juti Mojaris For Women  (Multicolor),4.4,Women,2195
Bellies Slip On For Women  (Black),4,Women,499
"SX9034G Walking Shoes For Men  (Navy, Red)",4,Men,949
Embroidery handicraft work Casuals For Women  (Multicolor),3.8,Women,499
Wedges Slip On For Women  (Red),,Women,599
Flip Flops,3.8,Women,700
Women White Heels Sandal,4.2,Women,999
Women Beige Wedges Sandal,3.8,Women,999
Women Brown Heels Sandal,4,Women,999
"Men Black, Red Sandal",4.2,Men,1399
Flip Flops,4,Men,499
"Women Off White, Brown Sports Sandal",4.3,Women,1199
Smash Wns Buckle Sneakers For Women  (White),4.4,Women,4499
Gold Zari Traditinal Punjabi Jutti Handmade Ethnic Mojari Embroided Jutti Jutis For Women  (Gold),,,1395
Women Gold Bellies Sandal,3.7,Women,1299
Bourge Women's Wfh-w-04 Mules,4,Women,599
M K Footwear 702_Blue Canvas Shoes For Men  (Blue),3.8,Men,999
Slippers,3.9,Men,349
"Men Black, Grey Sports Sandal",4.1,Men,899
Men Black Casual Sandal,4.1,Men,999
Men Multicolor Flats Sandal,3.7,Men,1499
"Mojaris For Men  (Gold, Black)",3.5,Men,499
Men Brown Sports Sandal,4.2,Men,2995
Flyer Runner Engineer Knit Running Shoes For Men  (White),4.1,Men,4499
Camel Synergy Stemar MOC008 Camel Casual Shoes For Men  (Tan),3.8,Men,499
Boots For Women  (Black),4.2,Women,999
ROSMO Outdoors For Women  (Grey),4.1,Women,2199
Women Tan Flats Sandal,3.9,Women,1595
Fly Star IDP Running Shoes For Women  (Grey),4.1,,4799
"Wmns Renew Arena Running Shoes For Women  (Black, Grey)",4.3,Women,5995
Latest Collection Bellies For Women Bellies For Women  (Beige),3.9,Women,999
"Men Navy, Blue Sandal",3.8,Men,599
Women Green Heels Sandal,4,Women,999
"2 Combo Shoes For Girls Stylish Lastes Fashion Sports Casual Canvas Sneakers Sneakers For Women  (Pink, Black)",4,Women,998
STYLISH-WHITE-6 Sneakers For Men  (White),3.8,Men,499
Men Grey Sports Sandal,3.8,Men,649
Women Copper Heels Sandal,4.2,Women,999
"Sports (Walking & Gym Shoes) Running, Sneakers Shoes for Men Pack of 3 Combo(O)-1595-1242-720 Running Shoes For Men  (Multicolor)",3.7,Men,1571
Women Beige Heels Sandal,4.4,Women,999
Women Black Wedges Sandal,3.9,Women,699
Nag Juti Jutis For Women  (Pink),4,Women,599
Slippers,4.7,Women,3999
"Men's Height Increasing Patent Casual Punjabi Jutti, Nagra And Mojari Mojaris For Men  (Blue)",4.2,Men,2999
"ARGO TREK SS 19 Tennis Shoes For Men  (Black, Grey)",4.1,Men,4299
Men Black Sandal,4.1,Men,2499
Bellies For Women  (Tan),4,Women,799
COOPER Slip-On For Men  (Tan),4.1,Men,1299
Women Copper Heels Sandal,4,Women,1199
"Breathable, Walking, Running, Casual,Gym Shoes Walking Shoes For Women Hiking & Trekking Shoes For Women  (Pink)",4.2,Women,1999
Women Grey Flats Sandal,4.3,Women,999
Flip Flops,,Men,139
Slippers,4.2,Men,329
ARYA - DIFFERENT EDGE Bellies For Women  (Navy),4.2,Women,4299
Oxford For Men  (Tan),4.3,Men,2595
Men Grey Casual Sandal,4,Men,1999
Jutis For Women  (White),4.1,Women,499
Combo Pack of 4 Latest Collection Stylish Casual Sneakers Shoes Sneakers For Women  (Multicolor),4.2,Women,1996
Women Black Heels Sandal,4.2,Women,599
Women Black Wedges Sandal,,,599
Women Silver Flats Sandal,3.9,Women,699
Men Grey Sandal,4.2,Men,2995
Women's Canvas High Heel Ankle Length Boots Boots For Women  (Green),3.5,Women,999
Women Black Heels Sandal,4,Women,999
Men Brown Casual Sandal,4.3,Men,799
Combo pack of 2 casual sneaker shoes for men Sneakers For Men  (Multicolor),3.7,Men,998
Women Black Heels Sandal,3.5,Women,1199
Women Multicolor Sports Sandal,4.2,Women,699
Golden Nag juti Jutis For Women  (Gold),3.9,Women,499
Combo Pack of 2 Latest Collection Stylish Shoes For Women Sneakers For Women  (Multicolor),3.8,Women,998
Premium Quality Boots For Men  (Black),4.1,Men,999
"Sneakers For Men  (White, Navy)",4.2,Men,1399
Boots For Women  (Black),3.4,Women,1049
Tan Synthetic Leather Formal Shoes Lace Up For Men  (Tan),4.1,Men,999
Zod Runner V3 IDP Running Shoes For Men  (White),4.1,Men,3999
Latest Comfort Flip Flops Black & White Men's Slipper Slides,3.4,Men,499
Men's White Printed Fabric wedding & Sherwani jutti Mojaris For Men  (Beige),4.2,Men,999
Women Copper Heels Sandal,4.3,Women,999
Men's Maroon Printed Fabric Velvet Jutis For Men  (Maroon),3.8,Men,999
Bellies For Women  (Brown),4.1,Women,499
821-6003 Lace Up For Men  (Black),4.2,Men,999
Boots For Women  (Brown),4.1,Women,999
LF_13 Flip Flops,4.1,Women,529
"Training ,Walking ,Gym ,Sports, Running Shoes For Women  (Blue)",3.9,Women,1599
Boots For Women  (Black),,Women,999
Women Off White Wedges Sandal,,,1299
Loafers For Men  (Beige),4,Men,999
Women Black Flats Sandal,3.8,Women,899
Walking Shoes For Men  (Black),4,Men,999
Women Beige Flats Sandal,4.1,Women,499
"Women Maroon, Brown Heels Sandal",4.2,Women,1249
Jutis For Men  (Black),,,799
VON HUETTE black ethinic tredy juti for mens Jutis For Men  (Black),3.9,Men,799
Casual Shoes Smart Running Shoes For Men  (Blue),3.8,Men,499
LANCE Slip On shoes For Men  (Black),3.7,Men,1999
"Punjabi Silk Ethnic Mojari, Juti, Bellies, Morpankh Design for Woman & Girl Bellies For Women  (Brown)",4.2,Women,499
Men Hawaii Chappal (Navy) Flip Flops,3.7,Men,699
Women Blue Wedges Sandal,4.1,Women,1499
Leather Casual Stylish Look Boots Shoes    Boots For Women  (Black),3.7,Women,999
Bolter W Running Shoes For Women  (Navy),4.2,Women,4299
Jalsa Jutis For Men Jutis For Men  (Black),3.7,Men,999
Jutis For Women  (Beige),4.1,Women,499
Slippers,4.1,Women,499
GEL CONTEND 4B+ Running Shoes For Men  (Black),4.2,Men,3499
"2 Combo Shoes For Girls Stylish Lastest Fashion Casual Canvas Sneakers Sneakers For Women  (Pink, White)",4,Women,1499
Court Star Vulc FS Sneakers For Women  (Green),,,5999
Combo Pack of 2 Casual Shoes Slip On Sneakers For Women  (Blue),3.8,Women,999
Slippers,3.8,Men,999
Casual Sneakers Hightop Shoes For Men  (Blue),4.1,Men,999
Women Tan Wedges Sandal,4.1,Women,999
Jutis For Women  (Multicolor),4.1,Women,799
Men's Black Printed Fabric Velvet Jutis For Men  (Black),3.8,Men,999
Men Brown Sandal,3.9,Men,799
"Men's Stylish Loafers For Men  (Red, Black)",3.9,Men,499
Mojaris For Women  (Orange),4,Women,499
"Women SL-126 Grey Pink Walking Shoes For Women  (Pink, Grey)",4.2,Women,949
Women Black Heels Sandal,3.8,Women,499
Bellies For Women  (Blue),3.9,Women,499
STRIDE RUNNER Running Shoes For Men  (Grey),4.3,Men,2099
"Women Natural, Beige Heels Sandal",3.7,Women,999
"Combo Men Pack of 2 Loafers Shoes Sneakers For Men  (Black, Red)",4,Men,998
Ankle Length Stylish Boots For Men  (Black),3.9,Men,999
Men's Formal Slip On For Men  (Black),4.1,Men,985
Mojaris For Men  (Black),3.4,Men,999
Fluo M Running Shoes For Men  (Blue),4.5,Men,3799
Men Tan Sandal,4,Men,999
"SOCKS Running Shoes For Men  (Grey, Red)",3.9,Men,999
Bellies For Women  (Black),4,Women,999
"Men SM-482 Olive Yellow Running Shoes For Men  (Olive, Yellow)",,Men,1349
Men Black Casual Sandal,3.6,Men,2399
Women Black Flats Sandal,3.9,Women,499
Training & Gym Shoes For Women  (Pink),4.3,Women,4499
"D'Lux Walker - Cross Motion Running Shoes For Women  (Black, Grey)",4.7,Women,5999
Slippers,4.7,Women,999
Men Navy Sandal,4,Men,799
Running Shoes For Women  (Green),4,Women,999
Gold sequence juti Jutis For Women  (Gold),4,Women,699
Women Blue Flats Sandal,4.1,Women,699
Women Brown Bellies Sandal,4.1,Women,999
Rexine Punabi Jutis Jutis For Women  (Multicolor),3.8,Women,460
Women Black Flats Sandal,4.2,Women,699
Flip Flops,3.4,Women,599
Women Yellow Flats Sandal,3.9,Women,572
Women Grey Heels Sandal,3.9,Women,999
Sneakers For Men  (Blue),3.8,Men,499
PRO-NP-AW05 Slip On Sneakers For Men  (Olive),4,Men,1899
Combo Pack of 2 Casual Shoes Slip On Sneakers For Women  (Blue),3.8,Women,999
Men Olive Sandal,4.1,Men,875
Women Blue Sports Sandal,5,Women,5997
Women Stylish Tan Boots For Women  (Tan),3.4,Women,1899
"Casual shoes,Running shoes,Walking shoes,Loafers,Sneakers,Traning shoes,Gym shoes. Sneakers For Women  (Blue, Black)",4,Women,998
Vendoz Women Sneaker Casual Shoes,3.8,Women,569
Women Black Wedges Sandal,4.1,Women,799
Women Brown Sports Sandal,4.4,Women,499
Mojaris Jutis For Men  (Black),3.8,Men,314
Ethnic Dark Brown Jutis For Women  (Brown),3.7,Women,499
Slides,3.5,Men,999
Women Burgundy Wedges Sandal,5,Women,1999
Jutis For Women  (White),3.9,Women,599
Long Boots Combo Boots For Women  (Black),4,Women,1998
Slippers,3.4,Men,1299
Puma Unisex's Cappela Idp Peacoat-Rhubarb White Sneakers,4.2,Women,1979
Men Grey Clogs Sandal,3.7,Men,999
Women Black Heels Sandal,4.6,Women,3995
Jaipuri juti Bellies For Women  (Multicolor),3.8,Women,699
"Sneakers For Men  (Black, White)",,Men,999
Bacca Bucci Men's Sneaker,3.6,Men,999
Belly-Velvat Bellies For Women  (Blue),4.2,Women,999
Men's White Casual Running Sports Shoes (Joggers) Running Shoes For Men  (White),4.1,Men,999
Womens Comfort Stylish Trending Heel (Pack Of 1 pairs)Size-7 Flip Flops,3.8,Women,518
Slip On For Men  (Brown),4,Men,1699
Women Maroon Wedges Sandal,4.2,Women,1199
"Women White, Multicolor Flats Sandal",3.9,Women,999
ARYA - DIFFERENT EDGE Bellies For Women  (Pink),4.2,Women,4299
"Shoes For Women's/Ladies/Female/Girls Trendy Fashionable Lightweight Comfortable Partywear, Casual wear Lace-UpCasual Stylish Boots/ Boots For Women Boots For Women  (Pink)",4.1,Women,899
"Zar Check Sneakers Casuals For Men  (White, Blue)",3.7,Men,999
DRAGON LADIES Running Shoes For Women  (Grey),4.1,Women,1699
Nucleus Run Sneakers For Women  (Black),4.3,Women,5499
Black Velvet Sharwani Jutti Jutis For Men  (Black),3.5,Men,699
Women Silver Flats Sandal,3.9,Women,699
Women Grey Bellies Sandal,3.9,Women,599
Women Gold Heels Sandal,4.1,Women,1299
"Men Brown, Tan Sandal",3.8,Men,1497
Womens Comfort Stylish Trending with colorful Printed Slippers combo (Pack Of 6 pairs) size 8 Slippers,3.8,Women,1499
"Women Pink, Gold Flats Sandal",3.9,Women,799
Slides,4,Men,1098
Synthetic Leather Casual Partywear New Design Stylish Sneakers Shoes For Womens And Girls Sneakers For Women  (White),4,Women,999
Women Copper Flats Sandal,4.1,Women,999
Loafers For Women  (Black),4,Women,999
Men Black Sports Sandal,4.2,Men,699
Combo of 5 Multicolor Casual Sneakers Shoes For Men Sneakers For Men  (Multicolor),4.1,Men,2495
Running Shoes For Men  (Orange),3.9,Men,999
Men Grey Clogs Sandal,3.8,Men,999
Slippers,4.3,Women,1199
Women Pink Heels Sandal,3.8,Women,999
Awesome Slip On For Men  (Black),4,Men,2290
S Buckle Boots For Women  (Black),4,Women,1299
Black Silk Sharwani Jutti Jutis For Men  (Black),4.3,Men,699
Women Black Flats Sandal,4.1,Women,599
Slip On For Men  (Brown),3.9,Men,499
Women Blue Wedges Sandal,3.9,Women,999
Slip On For Men  (Black),4,Men,4599
ALESSA Outdoors For Women  (Grey),4.5,Women,2299
Women Casual & Running Shoes Combo Pack of 2 Casuals For Women  (Multicolor),4,Women,798
Slippers,,Women,999
Women Brown Wedges Sandal,4.1,Women,999
GAIT RUNNER Running Shoes For Men  (Blue),4.4,Men,4299
Slippers,4.1,Women,499
Lace Up For Men  (Brown),3.9,Men,2399
Loafers For Men  (Black),4,Men,999
Bellies shoe For Women  (Black),4.2,Women,499
SL-172 Women Walking Shoes For Women  (Pink),4.5,Women,799
Women Red Flats Sandal,3.8,Women,999
Perfect Stylish Girls High Ankle Boots For Women  (Grey),4.2,Women,1499
Flip Flops,3.3,Women,499
"ENERGYLUX Running Shoes For Women  (Black, Grey)",4.2,Women,4499
Synthetic Leather Casual Partywear High Heels Stylish Boots Sneakers Casual Shoes For Womens And Girls Boots For Women  (Grey),4.2,Women,999
Men Brown Sandal,3.9,Men,999
Women Stylish Casual Sports Shoes Running Shoes For Women  (White),4,Women,999
Sneakers For Women  (Pink),4.2,Women,999
"Angel-04 Casual sneakers for ladies | sports shoes for women | Running shoes for girls stylish latest design new fashion | Lace up Lightweight grey shoes for jogging, walking, gym & party Walking Shoes For Women  (Grey, Pink)",4.1,Women,999
Women Multicolor Bellies Sandal,3.9,Women,499
Z_Rap For Men  (Tan),3.8,Men,999
Women Black Flats Sandal,3.7,Women,499
Flip Flops,4.3,Men,1299
Slides,,Women,599
Smash Badminton Shoes For Men  (Orange),4.2,Men,1990
"Flynit SOCKS, Ultra-Light Weight, Breathable Walking Shoes For Men  (Black)",3.9,Men,1126
"Inklenzo Men's Mesh Quality Black Running Sports Walking Casual Sneakers Shoes Size 6,7,8,9,10",3.4,Men,599
Women Black Flats Sandal,4.3,Women,999
Women Multicolor Flats Sandal,3.9,Women,499
"Men Black, Red Sandal",4.1,Men,899
WIKA_08 Sneakers For Women  (White),4.2,Women,799
Women's Leather Ankle Boots For Women  (Green),4.8,Women,999
Comfortable Shose For Women & Girl's Sneakers For Women  (Black),3.9,Women,999
Bellies For Women  (Multicolor),3.7,Women,999
"Women Copper, Brown, Burgundy Wedges Sandal",4.1,Women,1599
"Boots For Men  (Orange, Black)",4.1,Men,999
"Women Red, Gold Heels Sandal",3.9,Women,799
Women Brown Wedges Sandal,4.2,Women,999
Stylish and Comfortable Shoes For Man | Casual Office Wear Shoes for Man Lace Up For Men  (Tan),4.2,Men,999
Training & Gym Shoes For Men  (Navy),4.6,Men,1299
Women Brown Flats Sandal,4.5,Women,1295
"Ethnic Men's Golden Work Pointed Punjabi Mojari Mojaris For Men  (Black, Yellow)",4.1,Men,999
Bellies For Women  (Gold),4.3,Women,941
Women/Girls Mutli Casual Sneakers Formal Sneakers For Women  (Multicolor),3.9,Women,899
"Women Girl's Fashion Trendy Comfortable Slip On Bellies For Women  (Navy, Pink)",4.1,Women,559
Flip Flops,4.4,Women,999
"Sega 9 NavyBlue Marathon Running Shoes For Men  (Navy, Blue)",4.1,Men,949
Walking Shoes For Women  (Pink),4.4,Women,5199
1312 Casuals For Men  (Blue),3.9,Men,699
"Bellies For Women  (Brown, Tan)",3.6,Women,899
Women Multicolor Heels Sandal,3.8,Women,781
Slippers,4.5,Women,1199
Jutis For Women  (White),4.3,Women,499
Women Tan Heels Sandal,4.4,Women,1999
"Combo Men Pack of 2 Loafers Shoes Sneakers For Men  (Black, Red)",4,Men,998
CLAIRE (Collector's Edition) Running Shoes For Women  (Purple),4.4,Women,1299
Lace-Up Boots Shoes For Women's Boots For Women  (White),3.7,Women,999
Women Gold Flats Sandal,3.6,Women,899
KANEGGYE Casual Canvas Sneakers Shoes for Men,3.6,Men,399
Slides,4.2,Women,499
Slides,,Men,999
Women Beige Wedges Sandal,3.9,Women,999
Wedding And party wear Juti Jutis For Men  (Multicolor),3.4,Men,699
Jutis For Women  (Blue),4.1,Women,499
Awesome Oxford For Men  (Tan),3.9,Men,3690
Women Black Heels Sandal,4,Women,999
Slides,4,Men,1799
Women Brown Flats Sandal,4.1,Women,499
Women Blue Wedges Sandal,3.9,Women,699
Women Blue Heels Sandal,3.7,Women,999
Slipper for Men's Flip Flops Slides Home Open Toe Non Slip Brown Slippers,3.8,Men,599
"Century-12 Running shoes for boys | sports shoes for men | Latest Stylish Casual sport shoes for men | Lace up Lightweight Firozi shoes for running, walking, gym, trekking, hiking & party Running Shoes For Men  (Green, Red)",4.1,Men,999
Walking Shoes For Women  (Pink),4.3,Women,2995
"Stylesh High Tops For Men  (Red, Grey)",4.1,Men,999
Women Black Heels Sandal,4.1,Women,999
Formal Flip Flops,4.3,Men,299
Slides,3.9,Men,799
Women Blue Wedges Sandal,4,Women,499
"Stylish Casual Sports Shoe Sneakers For Women  (White, Pink)",4.2,Women,999
ROYCE-2 Running Shoes For Men  (Grey),4.2,Men,1049
Women Black Flats Sandal,4.1,Women,999
Perfect Stylish Girls Casual Shoes white Sneakers For Women  (White),4.1,Women,999
Women Tan Wedges Sandal,4.2,Women,999
Wonder Women Flex Lds4 For Women  (Pink),4.2,Women,1599
Women White Heels Sandal,4.2,Women,599
"Thunder Sneakers For Men  (Black, Grey)",3.8,Men,1199
m103 Running Shoes For Men  (Grey),3.8,Men,3245
Women Gold Heels Sandal,4.1,Women,999
Handmade Ethnic Juti Jutis For Women  (Gold),4.5,Women,2599
Converse Unisex Canvas Sneakers,4.3,Women,1959
New Stylish Girl's Denim Comfortable Fashionable Outdoor High Heel Ankle Boots for Women/Girls Boots For Women  Boots For Women  (Blue),4.4,Women,999
Flip Flops,3.7,Women,299
Bellies For Women  (Blue),4,Women,846
"Sneakers For Men  (White, Brown)",4.3,Men,999
Running Shoes For Men  (Orange),4.1,Men,999
Women Beige Wedges Sandal,3.8,Women,655
Women Multicolor Flats Sandal,3.9,Women,499
"Combo Pack of 3 Casual Sneaker Shoes For Women Sneakers For Women  (Pink, Pink)",4.1,Women,1199
Juttis For Men Jutis For Men  (Tan),4.1,Men,999
Bellies For Women  (Tan),3.9,Women,550
Men Blue Clogs Sandal,3.6,Men,799
Slides,4.2,Men,3999
Women Maroon Flats Sandal,3.3,Women,999
Slip On For Men  (Brown),4.4,Men,1399
"Men Red, Black Sandal",,,1000
"Jutis For Women  (White, Gold)",3.8,Women,798
"Women SL-124 Grey Pink Running Shoes For Women  (Pink, Grey)",4.3,Women,999
Flip Flops,4.1,Women,498
Ethnic Jutis For Women  (Multicolor),3.9,Women,499
Training & Gym Shoes For Women  (Grey),4.1,Women,999
Longwalk Women Casual Wear Sneakers Shoes Pack of 1,4.1,Women,299
Slippers,4.5,Men,799
Kolhapuris For Men  (Navy),4.2,Men,499
Jutis For Women  (Multicolor),4.1,Women,499
Sneakers For Women  (Black),4.2,Women,999
Men Ethinic Dark Brown jutti Jutis For Men  (Brown),3.5,Men,499
Sneakers For Women  (Multicolor),3.9,Women,998
Women Off White Heels Sandal,3.9,Women,999
Slip On For Men  (Black),4.2,Men,899
Women Grey Flats Sandal,4.1,Women,399
Lace Up For Men  (Black),4.2,Men,1799
"Century-04 Running shoes for boys | sports shoes for men | Latest Stylish Casual sport shoes for men | Lace up Lightweight black shoes for running, walking, gym, trekking, hiking & party Running Shoes For Men  (Black)",4.1,Men,999
Women Maroon Heels Sandal,4.1,Women,999
Women Black Wedges Sandal,4.1,Women,2490
Slippers,3.8,Women,499
Jutis For Men  (Brown),3.5,Men,999
party double chini Bellies For Women  (Gold),3.8,Women,999
Women Black Wedges Sandal,4,Women,999
Women Brown Heels Sandal,4.3,Women,799
Puma Wired Cage Sneakers For Men  (Black),4.4,,3499
EASY VULC 2.0 For Men  (Black),4.1,Men,3799
Chevit Men's Casual Shoes (Set of 2 Pairs),3.6,Men,397
Flip Flops,3.9,Women,299
Women Pink Bellies Sandal,4,Women,999
Sneakers For Men  (Grey),3.8,Men,999
Corporate Derby Lace Up Derby For Men  (Black),3.9,Men,999
Women Off White Bellies Sandal,3.9,Women,999
Men Blue Sandal,4.1,Men,2299
Latest Ladies Sports Lace Super Soft Running Shoes and comfortable Sneakers with Inner Fur Walking Shoes For Women  (White),4.3,Women,999
Stamp IDP Flip Flops,4.3,Men,1499
Extra Soft Walking Shoes For Women  (White),4.2,Women,999
VELVET LUXURIOUS SLIP-ON VELVET SHOES Loafers For Men  (Black),4.2,Men,1499
Perfect Stylish Girls Casual Shoes Sneakers For Women  (Pink),4.3,Women,999
"Women Red, Beige Flats Sandal",3.6,Women,599
Flip Flops,3.7,Women,499
Trendy and Comfortable Bellies For Women  (Multicolor),4,Women,999
Women Black Heels Sandal,3.9,Women,799
ULTRA FLEX - SILVER SURFING Running Shoes For Women  (Green),4.6,Women,5999
2_PAIR_COMBO Loafers For Men  (Multicolor),3.9,Men,999
Women Red Sandal,3.9,Women,499
Tan Synthetic Leather Slip On Jutis Mojaris For Men  (Tan),3.4,Men,990
Double Zip Lace Up Boots For Women  (Black),4.3,Women,999
RC3526 001 Slip On For Men  (Black),4.2,Men,4299
Casuals For Men  (Black),3.8,Men,499
Formal Shoe For Men  (Brown),4.2,Men,2699
Latest Collection Comfortable & Fashionable Lady Sports Shoes Party Wear Sneaker Shoes For Men  (Black),4,Men,999
"Running Shoes For Women  (Grey, Grey)",3.7,Women,999
BLACK SHARK Running Shoes For Men  (Black),3.9,Men,999
"Y King 2.0 W Running Shoes For Women  (Grey, Pink)",4.3,Women,3299
Slippers,4.1,Men,499
Men Black Sandal,4.2,Men,675
Bellies For Women  (Black),4.2,Women,499
Men's Solid Pattern Black PVC Loafer Or Mocassion Shoe Loafers For Men  (Black),3.7,Men,499
Women Pink Heels Sandal,4.1,Women,999
Slip On For Men  (Black),4.4,Men,1799
Walking Shoes For Men  (Blue),4.1,Men,999
EASY VULC 2.0 Sneakers For Men  (Green),4.2,Men,3799
Ruhi-07 Running Shoes For Women  (Pink),4,Women,599
casual for men sneaker shoes high top shoes stylish High Tops For Men  (Orange),4.1,Men,999
Flip Flops,4.2,Men,1299
Erdiga 3 M Running Shoes For Men  (Grey),4.1,Men,4299
"Women SL-165 Navy Blue Pink Walking Shoes For Women  (Navy, Pink)",4.3,Women,999
Women Casual Boots For Women  (Brown),4.2,Women,999
Ankle Length & High Ankle Length Boots For Women  (Grey),3.6,Women,1175
Slides,3.8,Men,999
Running Shoes For Men  (White),4.2,Men,1449
Men Brown Sandal,3.8,Men,1499
Slippers,4.2,Women,899
Shoes For Women Sneakers For Women  (Black),4.1,Women,799
Women Black Heels Sandal,4.3,Women,999
Jutis For Men  (Tan),,Men,999
Slides,3.4,Women,499
SM-162 Sneakers For Men  (Black),4.1,Men,949
"Ankle Strap Buckle Womens Casual Belies For Ethnic, Party, Formal Wear Casuals For Women Bellies For Women  (Blue)",4.2,Women,899
Women Pink Heels Sandal,4,Women,799
"Men Black, Khaki Flats Sandal",4.1,Men,2995
Urban Graphicster Wn's Sneakers For Women  (Multicolor),4,Women,2999
Women Grey Wedges Sandal,3.9,Women,999
Women Casual Boots For Women  (Brown),4.2,Women,999
Women Multicolor Bellies Sandal,4.1,Women,1085
Women Tan Wedges Sandal,4.1,Women,1299
"Blackwood n Running shoes, Gym Shoes, Training shoes, Walking Shoes Running Shoes For Men  (Blue, Grey)",3.8,Men,999
Synthetic Leather Black Formal Office Shoes Slip On For Men  (Black) Slip On For Men  (Black),3.6,Men,859
Derby For Men  (Black),3.9,Men,999
Mellow IDP Slippers,,Men,1499
MAXICO Running Shoes For Men  (Grey),4.1,Men,1299
Women Multicolor Flats Sandal,,Women,998
Jutis For Men  (Tan),4.1,Men,999
