title,Rating,maincateg,actprice1
Sneakers For Women  (White),4.2,Women,999
Men Multicolor Sports Sandal,4.1,Men,599
Ethnic Mule For Women  (Multicolor),4.1,Women,599
Perfect Stylish Girls Casual Shoes black Sneakers For Women  (Black),3.9,Women,999
Women Grey Flats Sandal,4.2,Women,699
Slip On For Men  (Black),4,Men,999
Zipper Synthetic Leather Casual Partywear New Design Stylish Boots For Women And Girls Boots For Women  (Pink),4.1,Women,999
Women Beige Wedges Sandal,4.1,Women,999
Black Full Leather Nagra Loafer shoes For Men  (Black),3.7,Men,999
Women Black Heels Sandal,4,Women,999
"Running Shoes For Women  (Black, Blue)",4.2,Women,3995
Synthetic Leather Casual Stylish Partywear Boots Shoes For Womens And Girls Boots For Women  (Grey),4.1,Women,999
Good Quality Boots For Women Boots For Women  (Black),4.1,Women,999
Flip Flops,4.1,Women,998
Women Copper Heels Sandal,4.1,Women,999
Women Off White Flats Sandal,3.8,Women,794
Women Pink Bellies Sandal,4.2,Women,799
Rajasthani handmade floral designs ethnic wedding footwear traditional shoes mojari jaipuri juti punjabi jutti casual jutti indian jutti mojari women shoes Jutis For Women  (Pink),3.7,Women,999
HYDRO LP Running Shoes For Men  (Blue),3.9,Men,4299
Casual Shoes for Women sneakers Girls shoes latest stylish Sneakers For Women  (Green),4.2,Women,999
Women Black Heels Sandal,3.7,Women,499
Boots For Women  (Black),3.8,Women,499
Earton Formal shoes for Men pack of 2 Combo(O)-1235-1240 Casuals For Men  (Multicolor),3.9,Men,998
Party Wear + Formal Shoes Slip On For Men  (Black),4,Men,999
Synthetic Leather Casual Partywear New Design Stylish Look Boots Shoes For Womens And Girls Boots For Women  (Grey),4.2,Women,1199
RUSH M Running Shoes For Men  (Blue),4.2,Men,3599
SFG-541 Slippers,4,Men,349
Red Chief Men's Casual Shoes,3.8,Men,2236
Training & Gym Shoes For Women  (Pink),4.4,Women,4499
"Gold Red Antique Wedding Shoes Formal Shoes Handmade Jooti Ethnic Jutti Mens Mojari Jutis For Men  (Gold, Red)",4.2,Men,799
Slides,3.2,Men,1497
Women Multicolor Heels Sandal,3.9,Women,499
Synthetic Leather Casual Partywear New Design Stylish Sneakers Shoes For Womens And Girls Sneakers For Women  (White),4,Women,999
GO STEP LITE - SWERVE Walking Shoes For Women  (Burgundy),4,Women,5851
Bellies For Women  (Blue),3.6,Women,999
SA 05 Slip On For Men  (Black),4.1,Men,999
Slip On For Women  (Black),3.6,Women,2299
FORTUNER Running Shoes For Men  (Burgundy),4.5,Men,1799
Women Pink Flats Sandal,3.7,Women,499
Wedges For Women  (Red),4,Women,999
"Latest Stylish Design-Modern Look Casual Moccasins for Women's & Girl's Latest | Fashionable Slip on Loafer, Office-Home Comfort Wear & Lightweight Loafers For Women  (Black)",4.2,Women,999
Derby For Men  (Brown),3.9,Men,1799
Campo Wn s IDP Running Shoes For Women  (Blue),4,Women,4999
Hellion Z W Running Shoes For Women  (Black),4.2,Women,3299
Jutis For Women  (Pink),3.9,Women,499
Women Brown Flats Sandal,4.1,Women,499
Derby For Men  (Tan),4.4,Men,2999
Casuals For Men  (Black),3.9,Men,999
RedBlack Marathon Walking Shoes For Men  (Red),4,Men,949
Women Black Wedges Sandal,4,Women,399
Men Maroon Sandal,3.9,Men,1299
Jutis For Men  (Beige),3.5,Men,599
Flip Flops,3.9,Women,1598
Women Black Heels Sandal,4.2,Women,599
Men's Black ankle lenght High Tops For Men  (Tan),4,Men,999
Women Pink Flats Sandal,4,Women,999
"Boots , shoes For Men pack of 2 Combo(O)-604-397 Hiking & Trekking Shoes For Men  (Multicolor)",3.6,Men,998
Loafers For Men  (Black) Driving Shoes For Men  (Black),4.2,Men,1998
SERENE - ELATION Walking Shoes For Women  (Pink),4.2,Women,4999
Flip Flops,,,999
Women Tan Flats Sandal,4.1,Women,999
Ethnic and Traditional Jute Slip On Red Men Mojaris Jutis For Men  (Red),4.2,Men,995
"Casuals For Women  (Maroon, Brown)",4.4,Women,999
"Men's Patent Faux Leather Jutti's, Nagra's and Mojari's Mojaris For Men  (Tan)",3.9,Men,999
Bellies For Women  (Pink),4.1,Women,1299
Sneakers For Women  (Black),3.9,Women,1101
Fashionable Bellies for Women's and Girl's Pack of 2 Bellies For Women  (Multicolor),4,Women,999
Women Black Bellies Bellies For Women  (Black),4,Women,1199
Women Beige Heels Sandal,4,Women,799
Women Gold Heels Sandal,3.4,Women,999
Running Shoes For Men  (Black),3.9,Men,999
Men Grey Flats Sandal,3.6,Men,1499
Voyager 1.0 Running Shoes For Men  (Black),4.2,Men,2499
Woman Comfortable Long Brown Shoe Boots For Women Boots For Women  (Brown),4.1,Women,999
Women Pink Bellies Sandal,4,Women,999
Slip On For Men  (Black),3.9,Men,999
Men Multicolor Sandal,3.8,Men,998
Floral IDP Running Shoes For Women  (Grey),4.1,Women,4499
Slip On Sneakers For Men  (Green),4.1,Men,998
Bellies For Women  (Black),4,Women,499
Bellies Slip On For Women  (Black),4,Women,499
Slides,4.3,Men,1899
UA W Surge SE Walking Shoes For Women  (Pink),4.5,Women,6499
SFG-48 Slippers,4,Men,424
Slip On For Men  (Brown),4.3,Men,1895
"Combo Pack of 3 Casual Shoes Running Shoes For Men  (Black, Blue)",3.8,Men,1499
KazarMax Women's Peach Sneaker,,Women,949
"Fit-Man Slip On Sneakers For Men  (Red, Black)",3.8,Men,1299
New Stylish Shoes Running Shoes For Men  (Blue),4,Men,499
Men Brown Sandal,4,Men,999
Women Navy Sports Sandal,4.3,Women,699
Wn s IDP Sneakers For Women  (Purple),4.3,Women,3299
"Socks Stylish Cricket , Walking Shoes , Light Weight Sports Shoes Running Shoes For Men  (Grey)",3.9,Men,999
Targaryen Lace Up Shoes For Men  (Black),3.9,Men,2399
Slides,3.8,Women,999
New Fashionable And Comfortable Sneakers For Women And Girls Party Wear Party Wear For Women  (Pink),4.1,Women,999
Shoes For Women Boots For Women  (Black),,Women,999
Jutis For Women  (Pink),3.9,Women,599
Women Multicolor Heels Sandal,3.4,Women,499
crocs Unisex's Clogs,4.7,Women,1607
Summer Latest Casual Formal Mojaris/Juttis/Nagra Shoes for Men's Mojaris For Men  (White),4,Men,1299
Men Black Sandal,3.8,Men,999
Ethnic Mule For Men  (Beige),,Men,999
Synthetic Leather Casual Partywear New Design Boots For Women  (White),4.2,Women,999
Boots For Women  (Red),4.3,Women,999
Women Red Heels Sandal,4,Women,999
"Women Red, Beige Heels Sandal",4,Women,999
Men Navy Sports Sandal,4.2,Men,499
Mojaris For Men  (Blue),3.8,Men,499
"Men-1200 Black Top Best Rates Training Shoes,Sports Shoes, Running Shoes For Men,Cricket Shoes,Casual Shoes,Loafers Shoes,Sneakers Shoes,Light Weight, Football Shoes,Comfortable For Men'S Walking Shoes For Men  (Black)",3.9,Men,499
RC3544 001 Slip On For Men  (Black),4.2,Men,3995
Women Black Heels Sandal,3.9,Women,799
Wedges For Women  (Blue),4.1,Women,999
"Women Black, Silver Sports Sandal",4.3,Women,1199
ZUMBA Dancing Shoe For Men Dancing Shoes For Men  (Multicolor),3.9,Men,999
EMBROIDERED STYLISH ETHNIC YELLOW JUTIS FOR WOMEN Jutis For Women  (Yellow),4,Women,699
Slip On For Men  (Brown),4,Men,1499
Men Multicolor Sports Sandal,4,Men,549
"REPECHAGE RUN Running Shoes For Women  (Blue, Green)",4.4,Women,2799
Pure Synthetic Leather Formal Shoes Slip On For Men  (Black),3.9,Men,999
Slip On For Women  (Blue),3.9,Women,1690
Combo Pack of 2 Latest Collection Stylish Loafers Sneakers Shoes For Women Sneakers For Women  (Multicolor),4,Women,998
Combo Women Pack of 2 Sneakers With Sports Shoes Walking Shoes For Women  (Multicolor),4,Women,998
ASIAN Women's Navy Blue & White Modern Shoes -6 UK/Indian,3.7,Women,379
Women Black Heels Sandal,4.1,Women,999
Women Grey Flats Sandal,4.1,Women,799
Women Black Flats Sandal,4,Women,1599
Casuals For Women  (Red),3.8,Women,499
"Men SM-397 Black Red Running Shoes For Men  (Red, Black)",4.2,Men,1049
"Riya-04 Navy Pink Sports Shoes,Gym Shoes,Casual Shoes,Walking Shoes, Running Shoes For Women  (Navy, Pink)",4.1,Women,489
ADIDAS SLEEK W Sneakers For Women  (Blue),4.6,Women,7599
Women Silver Wedges Sandal,4,Women,549
Perforated Low IDP Sneakers For Men  (Blue),4.2,Men,3999
Women Gold Wedges Sandal,4.1,Women,499
Slides,3.9,Women,999
Slippers,4.5,Women,1199
Men Synthetic Leather Office Black Formal Shoes For Men  (Black),4,Men,999
TRENDY SNEKEARS FOR MEN Sneakers For Men  (Blue),4,Men,499
EXPLORE Sneakers For Men  (Navy),4.1,Men,1899
"2 Combo Shoes For Girls Stylish Lastes Fashion Sports Casual Canvas Sneakers Sneakers For Women  (Pink, Black)",4,Women,998
ZF Klub Men's Lace up Walking Shoes Running Shoes Lightweight Breathable Mesh Fashion Sneakers / Designer party Wear For Men (black new look wise ) For Men  (Black),3.8,Men,999
Bellies For Women  (Black),3.7,Women,1499
Bellies For Women  (Silver),,Women,533
crocs Unisex_Adult Crocband Gallery Clog,4.4,Women,2040
Training & Gym Shoes For Women  (Pink),4.4,Women,4499
Women Grey Flats Sandal,3.9,Women,799
Comfortable Stylish Latest Design Walking Shoes For Women  (White),4.1,Women,999
Sneakers For Women  (Pink),4.2,Women,999
Women Black Flats Sandal,4.2,Women,999
Casuals For Men  (Tan),3.9,Men,999
"101 loafer Loafers For Men  (Black, Yellow)",,Men,999
"Running Shoe, Gym, Walking Daily Wear Running Shoes For Men  (Green)",4,Men,999
ARYA - DIFFERENT EDGE Bellies For Women  (Pink),4.1,Women,4299
Women Black Heels Sandal,4.1,Women,999
Women Black Wedges Sandal,4.4,Women,999
Patent Bellies For girls Bellies For Women  (Black),4.1,Women,999
"Walking Shoes For Women  (Pink, Grey)",4.2,Women,1499
Men's Black Oxford Lace Up For Men  (Black),3.7,Men,499
Sneakers For Men  (Black),4.1,Men,999
Roma Reinvent Wn's Sneakers For Women  (Black),4.3,Women,6499
Men Black Sandal,4,Men,999
Women Black Wedges Sandal,3.8,Women,699
"Zar Check Sneakers Casuals For Men  (White, Blue)",3.7,Men,999
Xyork MU IDP Running Shoes For Men  (Grey),4.2,Men,3999
Multicolor-611 Sneakers For Women  (Multicolor),3.6,Women,499
Boots For Women  (Black),4.1,Women,999
"Sneakers For Men  (White, Brown)",4.3,Men,999
Flip Flops,3.9,Men,1499
Women Pink Flats Sandal,4.1,Women,499
Women Black Heels Sandal,4,Women,999
"Loafers For Men  (Tan, Brown, Black, Bronze, Beige)",4,Men,1499
"Cosko Sports Shoes,Running Shoes,Walking Shoes,Training Shoes, Running Shoes For Men  (Navy, Blue)",4.1,Men,999
"Women's Casuals Shoes,Walking Shoes Mesh Sports Shoes Casuals For Women  (Red)",3.8,Women,499
Ethic Mules for men | Classy Mules | Gents mules Mojaris For Men  (Black),4.1,Men,1199
Mojaris For Men  (Black),3.9,Men,499
Synthetic Lace Up For Men  (Black),3.9,Men,1299
Women Copper Wedges Sandal,4,Women,999
"punjabi jutti , nagra , nagra shoes , jutti , jalsa , mojari , rajasthani jutti Mojaris For Men  (Blue)",3.9,Men,499
Training & Gym Shoes For Men  (Black),4.1,Men,1499
"Women SL-165 Violet Grey Walking Shoes For Women  (Purple, Grey)",4.3,Women,999
Corporate XI Office Formal shoes Lace Up For Men  (Tan),,Men,999
"Hattrick-09 Running shoes for boys |sports shoes for men | Latest Stylish Casual sneakers for men | Lace up lightweight white shoes for running, walking, gym, trekking, hiking & party Running Shoes For Men  (White, White)",4,Men,999
Slip On For Men  (Black),4.1,Men,999
Women Black Heels Sandal,4.1,Women,999
"Jio-13 Running Shoes For Men  (Red, Green)",4.1,Men,471
Women Beige Heels Sandal,3.8,Women,678
New Fashionable And Comfortable Sneakers For Women And Girls Party Wear Party Wear For Women  (Pink),4.1,Women,999
PW TENNIS HU W Sneakers For Women  (White),4.7,Women,8999
Sneakers For Men  (Red),3.9,Men,999
Multicolor Combo-(5)-486-689-723-720-462 Casuals For Men  (Multicolor),4,Men,2490
Women Tan Wedges Sandal,3.9,Women,999
Men's Office Formal shoes Slip On For Men  (Tan),3.9,Men,999
Capster NU IDP Slippers,4.3,Men,1699
ULTIMAMOTION Sneakers For Women  (Grey),4.4,Women,5599
Rajasthani Jaipuri Partywear Ethnic Womens Girls Ladies Jutis For Women  (Beige),3.9,Women,499
Womens Comfort Block Stylish Trending Dark Blue Yellow and White slippers with transparent strap Flip Flops,3.8,Women,499
Canvas Shoes For Men  (Grey),3.7,Men,499
Wedges Slip On For Women  (Black),4.1,Women,599
Bellies For Women  (Red),4.1,Women,499
Synthetic Leather Black Formal Shoes Slip On For Men  (Black),4.1,Men,999
ADIDAS SLEEK W Sneakers For Women  (Blue),4.6,Women,7599
Women Red Flats Sandal,3.9,Women,799
Ketava Duo GU IDP Slippers,4.2,Men,1399
Leather Design Stylish Look Boots Shoes Boots For Women  (White),4.2,Women,1399
Men Multicolor Sandal,3.8,Men,998
Formal Shoes For Men  (Tan),4.1,Men,2699
Men Olive Sports Sandal,4.2,Men,3495
Bellies Slip On For Women  (Black),4,Women,499
Slippers,4,Women,556
"Women Black, Silver Wedges Sandal",4.2,Women,599
Boots For Women  (Black),4.4,Women,999
Women Gold Wedges Sandal,4,Women,999
CARBON Running Shoes For Men  (Black),4.1,Men,799
FORMAL SHOES Lace Up For Men For Men  (Black),4.1,Men,999
"MARVEL-21 For Men  (Green, Grey)",3.9,Men,599
SM-162 Black Walking Shoes (Black) For Men  (Black),4.1,Men,499
Men Black Sandal,4.1,Men,2499
Rajasthani Jaipuri Partywear Ethnic Womens Girls Ladies Jutis For Women  (Off White),4,Women,799
Corporate Dress Shoes Derby For Men  (Black),4.1,Men,799
Women Black Flats Sandal,,Women,655
Women Brown Wedges Sandal,4.1,Women,2490
Women Blue Flats Sandal,3.7,Women,550
New Fashionable And Comfortable Sneakers For Women And Girls Party Wear Party Wear For Women  (Pink),4.1,Women,999
Combo Pack of 4 Latest Collection Stylish Casual Loafer Sneakers Shoes Sneakers For Women  (Multicolor),4,Women,1996
Corporate Lace-up Formal Shoes For Men Derby For Men  (Brown),3.7,Men,999
Derby For Men  (Black),4,Men,899
Women Black Flats Sandal,4.1,Women,499
NEYMAR Flip Flops,4.3,Men,499
SUPREME Jutis For Men  (Brown),4.2,Men,2499
Latest Collection For Women And Girls Bellies For Women  (Blue),3.8,Women,499
Women Black Flats Sandal,4.1,Women,599
Amazon Brand - House & Shields Men's Canvas Sneakers,4.6,Men,530
Flip Flops,3.6,Men,999
Women Pink Flats Sandal,4,Women,826
Women Silver Wedges Sandal,3.7,Women,499
Women Brown Wedges Sandal,4,Women,499
Exclusive Hip Hop Dancing Boots Sneakers High Tops For Men  (Orange),4,Men,999
Flip Flops,4,Men,1299
Flip Flops,4.2,Women,499
Women Grey Wedges Sandal,4,Women,1599
Jalsa Nagra Jutti Mojaris For Men Mojaris For Men Mocassin For Men Ethnic Mule For Men  (Black),3.7,Men,999
Ekaaya Handmade Royal Rajasthani Rajwari Jaipuri Ethnic Wedding Juttis Bellies for Women Girls Bellies For Women  (Multicolor),4,Women,1299
Women Beige Heels Sandal,4.3,Women,816
"D-SNEAKERZ Sneakers Shoes for Men Boys Latest, Mens Sneakers Shoes Casual",3.6,Men,699
Men Brown Sandal,4,Men,999
Latest Collection Sneakers For Women  (White),4,Women,499
Synthetic Leather Casual Partywear Boots Casaul Shoes For Women's And Girls Boots For Women  (Tan),4.2,Women,999
Ankle Length & High Ankle Length Boots For Women  (Black),4.1,Women,999
"Hyperon 1.0 W Running Shoes For Women  (Grey, Yellow)",4.2,Women,2999
"Totu Womens Black and Red Casual Stylish Comfort ortho High Heel (Pack Of 1) Flip Flops , Size-5 Flip Flops",3.8,Women,499
CAMANDO Running Shoes For Men  (Navy),4.2,Men,1699
Smart Casuals Canvas Shoes Combo pack of 2 Sneakers For Men  (Multicolor),4,Men,998
Boots For Women  (Maroon),4.5,Women,999
Jutis For Women  (Tan),4,Women,599
SL 154 Walking Shoes For Women  (Blue),4.3,Women,999
Zipper Synthetic Leather Casual Partywear New Design Stylish Boots For Women And Girls Boots For Women  (White),4.3,Women,999
Women Pink Flats Sandal,4,Women,999
Jutis For Women  (Multicolor),4,Women,999
"Century-12 Running shoes for boys | sports shoes for men | Latest Stylish Casual sport shoes for men | Lace up Lightweight Firozi shoes for running, walking, gym, trekking, hiking & party Running Shoes For Men  (Green, Red)",4.1,Men,999
Slippers,4,Women,499
Juti For Men Jutis For Men  (Olive),3.9,Men,999
Women Black Flats Sandal,4,Women,499
PRO-NP-AW05 Slip On Sneakers For Men  (Grey),4,Men,1899
Women Black Heels Sandal,4,Women,799
Magnet Strap Mesh Shoe Walking Shoes For Men  (Grey),3.7,Men,1499
Stylish Flat Mules for women Bellies For Women  (Copper),4,Women,699
Women Pink Wedges Sandal,3.9,Women,499
Lace Up For Men  (Brown),3.9,Men,1899
Women Pink Flats Sandal,4.1,Women,999
Zod Runner V3 Wn s IDP Running Shoes For Women  (Purple),4.3,Women,3999
Cool Sneakers For Men  (White),,Men,999
Pure Synthetic Leather Formal Shoes Slip On For Men  (Tan),3.9,Men,999
Cool nagra Slip On For Men  (Copper),3.7,Men,799
Flip Flops,4.3,Men,899
Loop X IDP Running Shoes For Men  (Grey),4.6,Men,2999
Women Gold Heels Sandal,4.3,Women,1599
Red Chief Men's Sneakers,,,4499
Multicolor Bellies For Women  (Black),4.2,Women,700
Active Walking Shoes For Women  (Navy),4.4,Women,2490
"Combo Pack of 3 Casual Sneaker Shoes For Women Sneakers For Women  (Pink, Pink)",4.1,Women,1199
For Men  (Tan),4,Men,1853
Flip Flops,3.3,Women,499
Xymbolic Men's Casual Shoes,3.8,Men,499
Handmade Velvet Ethnic Punjabi Rajasthani Jutti Slip On For Women  (White),3.8,Women,999
Women Gold Heels Sandal,4,Women,999
Women Pink Wedges Sandal,3.8,Women,499
Men's Synthetic Leather Long Boots Boots For Men  (Brown),3.6,Men,999
Derby For Men  (Black),4.2,Men,6299
"Latest Stylish Look Lightweight-Silicon Rubber Flip Flop for Men's & Boy's| Sweat Resistant, Non Slip and Water-Proof Slides - Indoor and Outdoor Casual wear Slippers Slippers",3.8,Men,499
Leather Semi-formals Derby For Men  (Brown),4.2,Men,5695
Boots For Women  (Blue),3.5,Women,5499
Slippers For Women (Brown) Slippers,4.3,Women,499
Velvet Juti Mojari Jutis For Men  (Black),4,Men,599
"88 Running Shoes For Women  (Purple, Pink)",4.3,Women,999
"Bullet-02 Walking Shoes For Men  (Grey, Green)",4,Men,599
Sneakers For Women  (White),4.2,Women,999
Slides,4,Women,599
"Racer-81 Canvas shoes for ladies | sneakers for women | Casual shoes for girls stylish latest design new fashion | Lace up high top blue shoes for running, walking, gym, trekking & party For Women  (Blue)",3.8,Women,499
Women Black Flats Sandal,4.2,Women,999
Slides,3.7,Men,999
Sports Mesh Running Shoes For Women  (Green),4,Women,899
Trendy Casuals For Men  (Black),3.9,Men,999
Jutis For Women  (Pink),,Women,499
RC3498 003 Boots For Men  (Brown),4,Men,4099
Flip Flops,4,Men,999
Women Black Heels Sandal,4.1,Women,999
Boots For Women  (Black),3.9,Women,999
Women Pink Heels Sandal,4,Women,799
Slippers,4.3,Women,1199
Men Grey Sandal,4.1,Men,699
"Jutis For Women  (Orange, Beige)",,Women,499
Women Black Flats Sandal,,Women,999
"punjabi jutti , nagra , nagra shoes , jutti , jalsa , mojari , rajasthani jutti Mojaris For Men  (Black)",3.8,Men,499
Fierce Rope VR Wn s Running Shoes For Women  (Black),4.5,Women,7999
CNV6012WT Sneakers For Women  (White),4,Women,999
Bellies For Women  (Gold),3.7,Women,599
Slip On For Men  (Brown),3.8,Men,1799
Flip Flops,3.9,Men,499
Fly Star IDP Running Shoes For Women  (Grey),4.1,Women,4799
Women Blue Wedges Sandal,2.4,Women,1999
"Women SL-165 Navy Blue Pink Walking Shoes For Women  (Navy, Pink)",4.3,Women,999
Men Black Casual Sandal,3.8,Men,999
"Men Navy, Blue Sandal",3.8,Men,599
Sneakers for Women Sneakers For Women  (White),4.8,Women,999
Men Synthetic Leather Office Black Formal Shoes For Men  (Black),3.7,Men,999
"Totu Womens Black and Red Casual Stylish Comfort ortho High Heel (Pack Of 1) Flip Flops , Size-5 Flip Flops",3.8,Women,499
SK LIGHTER Men's Training Shoes,3.2,Men,399
Men Pink Clogs Sandal,3.6,Men,3295
S-9 Running Shoes For Men  (Grey),4.1,Men,599
New Trendy Fashionable And Comfortable 2 Combo Sneakers Partywear Shoes Casual wear Sneakers For Women And Girls Sneakers For Women  (Multicolor),3.9,Women,998
Women Tan Flats Sandal,3.4,Women,999
Women Red Flats Sandal,4,Women,999
Climber Boots For Men  (Black),4.4,Men,999
Men's Synthetic Leather Formal Shoe For Men  (Black),4.3,Men,1999
Designer Loafers For Men  (Blue),4,Men,499
Rajasthani Jaipuri Ethnic juti Bellies For Women  (Pink),4.2,Women,799
SOLAR FUSE Walking Shoes For Men  (Navy),4.2,Men,5999
Combo pack of 2 Men Sports & Running Sports Shoes Walking Shoes For Men  (Multicolor),3.7,Men,998
"Red Running shoes for boys | sports shoes for men | Latest Stylish Casual sneakers for men | Lace up lightweight white shoes for running, walking, gym, trekking, hiking & party Running Shoes Lace Up For Men  (Red) Running Shoes For Men  (Red)",4,Men,1599
Women Navy Wedges Sandal,3.8,Women,999
Women Beige Wedges Sandal,3.8,Women,999
Shoes_FY727 Slip On Formal Shoes For Men Slip On For Men  (Black),3.7,Men,999
Women Black Flats Sandal,3.9,Women,799
Boots For Women  (Red),3.6,Women,1999
Backcourt SL Sneakers For Men  (Black),4.4,Men,5999
Stylish & Fashionable Slip-on 0.5 Inch. Bellies For Women  (Black),,Women,699
Women Black Wedges Sandal,3.3,Women,449
Corporate Casuals For Women  (Black),4.1,Women,599
Smart Casuals Canvas Shoes Combo pack of 2 Sneakers For Men  (Multicolor),4,Men,998
ISLAY FLIP LP Flip Flops,4,Men,1399
"SPEED XT ENHANCED LP Running Shoes For Women  (Black, Pink)",4.4,Women,3499
Women Tan Wedges Sandal,2.4,Women,1999
Jutis For Women  (Purple),3.9,Women,499
Pure Syntethic Leather Formal Shoes For Men Lace Up For Men  (Black),4,Men,816
"Shoes For Women's/Ladies/Female/Girls Trendy Fashionable Lightweight Comfortable Partywear, Casual wear Lace-UpCasual Stylish Boots/ Boots For Women  (Blue)",4.3,Women,999
Men Brown Casual Sandal,4.2,Men,2695
Longwalk Women Casual Sneakers Shoes,4.5,Women,454
Bellies For Women  (Black),4.2,Women,999
Women Black Heels Sandal,4,Women,799
Bellies shoe For Women  (Black),3.8,Women,499
Women Natural Wedges Sandal,4.3,Women,999
Women Brown Bellies Sandal,3.9,Women,999
Bella Toes Women White Pink Casual Sports Shoes Sneakers_6011,4.1,Women,699
"Women Tan, Brown Heels Sandal",4.2,Women,1299
"punjabi jutti , nagra , nagra shoes , kurta shoes , shoes for kurta pajamas , juti , jalsa , mojari Jutis For Men  (Brown)",3.8,Men,499
Sneakers For Men  (Blue),3.6,Men,1099
"SENSEBOUNCE + STREET W Running Shoes For Women  (Black, Grey)",4.1,Women,6999
Flip Flops,,Men,999
High Tops For Men  (Grey),4.3,Men,4299
Slippers,4.1,Women,399
FLEXAGONFORCE Walking Shoes For Women  (Black),4.4,Women,4999
Trendy and Comfortable Bellies For Women  (Black),4,Women,899
Women Blue Wedges Sandal,4.1,Women,1499
Mens Formal Brown Shoe Slip On For Men  (Brown),3.8,Men,999
High Top Girls Canvas Heel Sneakers Canvas Shoes For Women  (Black),4.1,Women,999
"GEL-QUANTUM 360 KNIT Running Shoes For Women  (Blue, Grey)",4.3,Women,15999
"Latest Ankle Combat Boots | Anti-Slip, Lace-up, Fashion Casual Booties| Raniy, Winter- Snow Boots For Women  (Black)",3.8,Women,1999
Men Brown Sandal,3.8,Men,2299
Comfortable Stylish Latest Design Walking Shoes For Women  (White),4.1,Women,999
Boots For Women  (Tan),3.7,Women,1999
Walking Shoes For Men  (Red),4.1,Men,999
Action Synergy Black ME432 Lace Up Shoes For Men  (Black),3.8,Men,999
Sports Mesh Running Shoes For Women  (Green),4,Women,899
Women Black Flats Sandal,4.1,Women,999
Partywear ethnic Juti Casuals For Women  (Pink),3.7,Women,499
Doctor Extra Soft Flat Ortho Care Diabetic Orthopaedic Comfort Dr Slippers and Flipflops For Women's and Girl's Flip Flops,4.1,Women,499
Gazelle W Sneakers For Women  (Pink),,Women,7999
Sea Max Men Brown Jutis [Mojaris] Jutis For Men  (Brown),3.9,Men,1999
Women Copper Flats Sandal,4,Women,999
Men Brown Sandal,3.8,Men,1999
Casual ethnic juties Jutis For Men  (Tan),3.8,Men,999
Women Silver Heels Sandal,3.7,Women,999
Jutis For Women  (Red),4,Women,599
ARYA - DIFFERENT EDGE Bellies For Women  (Pink),4.1,Women,4299
Women Red Phulkari Jutti Handmade Punjabi Jutti Mojari Online Handmade Jutis For Women  (Red),4.3,Women,1395
Women Black Flats Sandal,3.9,Women,599
Dashing Looking Jutis For Men  (Brown),4,Men,999
Women Blue Wedges Sandal,4.2,Women,999
Women Black Heels Sandal,4,Women,729
Men Green Sandal,3.2,Men,999
"punjabi jutti , nagra , nagra shoes , jutti , jalsa , mojari , rajasthani jutti Jutis For Men  (Blue)",3.3,Men,499
Zipper Synthetic Leather Casual Partywear New Design Stylish Boots For Women And Girls Boots For Women  (Pink),4.1,Women,999
Girls Stylish & Comfortable | Casual | Party Wear Boots For Women  (Brown),4.2,Women,999
Women Black Flats Sandal,3.9,Women,599
Lace Up For Men  (Black),4,Men,999
"JESS Sneakers For Men  (Red, White, Black)",4.3,Men,3299
Loafers For Men  (Blue),3.9,Men,499
Slides,4.1,Women,499
Women Pink Bellies Sandal,4.1,Women,499
"Women Blue, Gold Flats Sandal",3.8,Women,499
Leather Formals Slip On For Men  (Black),4,Men,2495
Canvas Shoes For Men  (Grey),4.2,Men,2099
Men Blue Sandal,4.1,Men,1499
Boots For Women  (White),4.3,Women,999
Sneakers for men(blue_6) Sneakers For Men  (Blue),4.1,Men,999
Good Quality Shoes More Comfortable And Light Weight Shoes for Women Bellies For Women  (Black),3.9,Women,999
AGROHA-1969-GREY-7 Casuals For Men  (Grey),3.7,Men,999
Lace Up For Men  (Black),3.9,Men,1699
"Urban Graphicster Wn's Sneakers For Women  (White, Maroon)",4,Women,2999
Casuals For Men  (Blue),3.8,Men,999
Men Olive Sandal,3.7,Men,1399
Women Black Heels Sandal,4.1,Women,999
Rajasthani Jaipuri jutti for girls and women Jutis For Women  (Multicolor),4.1,Women,845
Women Black Heels Sandal,3.7,Women,999
Women's Red Ethnic Leaf Sitara Printed Fabric Jutti Mojari Casuals For Women  (Red),4,Women,499
Elle Wine Color Casual for Women's Flip Flops,3.8,Women,499
Combo Pack of 5 Casual Sneakers With Sneakers For Men  (Multicolor),4,Men,3999
Flip Flops,3.8,Men,799
Outdoor Shoe For Men  (Brown),4.4,Men,3895
By Bata Slip On Shoes For Men  (Black),3.9,Men,3499
Girls Canvas Heel Sneakers For Women  (Red),4,Women,649
"GLECK Men's Casual Canvas Sport Shoes, Corporate Casual Outdoor Lace-Up Shoes, Running/Walking/Training and Gym Shoes Running Shoes For Men  (Multicolor)",3.8,Men,999
Bellies Jutis For Women  (Blue),3.2,Women,600
Rajasthani Jaipuri jutti for girls and women Jutis For Women  (Multicolor),4.1,Women,999
