title,Rating,maincateg,actprice1
Designer Jaipuri Silk Jutti Rajasthani Mojari for Women and Girls Bellies For Women  (Multicolor),3.9,Women,744
"sports shoes for men | Latest Stylish Casual sneakers for men | Lace up lightweight shoes for running, walking, gym, trekking, hiking & party Running Shoes For Men | Running Shoes For Men (Black) Sneakers For Men  (Black)",3.7,Men,999
Men's Leather Maroon Punjabi Mojari Mojaris For Men  (Maroon),3.9,Men,999
High heels Tan color Boots For Women Boots For Women  (Black),4,Women,999
Women Black Bellies Sandal,4,Women,999
Awesome Derby For Men  (Tan),3.8,Men,3990
DRAGON LADIES Running Shoes For Women  (Grey),4.1,Women,1699
Black Transparent Slides,4,Women,399
Men Brown Sandal,3.3,Men,1599
Combo Pack of 4 Latest Collection Stylish Casual Loafer Sneakers Shoes Sneakers For Men  (Multicolor),,,1996
Women Black Bellies Sandal,4.1,Women,999
"Socks Stylish Cricket , Walking Shoes , Light Weight Sports Shoes Running Shoes For Men  (Blue)",3.9,Men,999
Slides,3.9,Men,499
Derby For Men  (Tan),4.6,Men,2999
Women Tan Flats Sandal,4.1,Women,999
Casual Shoes for Women sneakers Girls canvas shoes latest stylish Sneakers For Women  (Pink),4.2,Women,999
Mojaris For Men  (Black),3.8,Men,1299
Sneakers For Men  (Multicolor),3.9,Men,999
Wedges For Women  (Black),1.8,Women,999
High Top Girls Canvas Heel Sneakers Canvas Shoes For Women  (Black),4.1,Women,999
Men Black Flats Sandal,4.2,Men,2499
Women Black Bellies Sandal,3.9,Women,999
Rajasthani Jaipuri Partywear Ethnic Womens Girls Ladies Jutis For Women  (Pink),4,Women,599
Bellies For Women  (Beige),4,Women,599
SYTHETIC Leather Punjabi Jutti Red. Mojaris For Men  (Red),3.9,Men,999
"Running Shoes Running Shoes For Women  (Red, White)",3.7,Women,525
Slip On For Women  (Black),3.8,Women,999
Rajasthani Jaipuri Work Ethnic Womens Girls Ladies Belly Jutis For Women  (Multicolor),4,Women,599
Women Black Wedges Sandal,4.2,Women,279
Lightweight Gymwear Sport Running Shoes For Men Walking Shoes For Men  (Black),3.8,Men,999
Inklenzo Men's Orange Sneakers Running and outdoor Gym Walking Daily Wear Shoes Dancing Shoes For Men  (Orange),4,Men,999
Multi Colored Embroidery Velvet Ethnic Rajasthani Jaipuri Belly Shoes for Women and Girls Jutis For Women  (Multicolor),4.8,Women,999
Men Multicolor Clogs Sandal,3.7,Men,899
Men Black Sandal,3.7,Men,2199
DOCTOR EXTRA SOFT Flat Ortho Care Diabetic Orthopaedic Comfort Dr Slippers and Flipflops For Women's and Girl's Slippers,4.1,Women,599
Gerry Formal Shoes For Men  (Black),3.8,Men,3599
"Red Silk Sherwani Jutis For Men Mojaris For Men  (Red, Gold)",4,Men,799
Women Pink Flats Sandal,3.9,Women,1399
TORMO SLIP ON Slip On For Men  (Black),4.1,Men,1299
Women Copper Flats Sandal,4.2,Women,999
Women Black Heels Sandal,4.3,Women,799
Black Synthetic Leather Formal Shoes Slip On For Men  (Black),4.1,Men,999
Sparx Men Blue Flip Flops Slippers SFU 204 Slippers,4.1,Men,284
Men White Sandal,4.3,Men,2995
"Combo Pack of 2 Latest Collection Stylish Casual Loafer Sneakers Shoes For Men Sneakers For Men  (Blue, Red, Black)",4,Men,1009
GOLDIE-FLASHOW Slip On Sneakers For Women  (Black),3.4,Women,5999
Sneakers For Women  (Tan),3.6,Women,999
Sneakers For Women  (White),4.2,Women,999
Women Black Heels Sandal,4,Women,999
New Stylish Shoes Running Shoes For Men  (Blue),4,Men,499
Women Gold Flats Sandal,4.1,Women,699
Sneakers For Men  (Brown),3.6,Men,499
"Breathable, Walking, Running, Casual,Gym Shoes Walking Shoes For Women  (Pink)",4,Women,999
Training & Gym Shoes For Women  (Pink),4.4,Women,4499
Slippers,3.8,Women,998
"Heemaani Black & White Shoes For Women & Girls Sneakers For Women  (Black, White)",3.9,Women,999
"Men Blue, Grey Sports Sandal",4,Men,1399
Women Pink Wedges Sandal,4.3,Women,599
"Partywear Casual Shoes for Men's (Red, 08) High Tops For Men  (Red)",4.1,Men,999
Kraasa Men's Synthetic Leather Sneaker,3.2,Men,499
Women Gold Heels Sandal,3.8,Women,999
synthetic Leather Bellies For Women  (Tan),4.1,Women,699
Boots For Women  (Red),4.1,Women,1999
Women Pink Heels Sandal,3.7,Women,999
Slides,4.1,Women,499
"Latest Collection, Comfortable & Fashionable Bellies for Women's and Girl's Pack of 2 Bellies For Women  (Navy, Pink)",3.9,Women,999
Flip Flops,4,Women,1298
Jutis For Men  (Black),3.8,Men,999
Women Red Flats Sandal,3.9,Women,499
Running Shoes For Men  (Red),4.2,Men,2395
"D'Lux Walker - Cross Motion Running Shoes For Women  (Black, Grey)",4.7,Women,5999
Awesome Jutis For Men  (Tan),4.2,Men,2990
SL-138 Casuals For Women  (White),4.1,Women,625
Women Black Heels Sandal,3.9,Women,550
Synthetic Leather Casual Partywear Boots Shoes For Women And Girls Boots For Women  (Grey),4.1,Women,999
Oxford For Men  (Tan),4.2,Men,6299
Slippers,3.8,Women,499
Sports Running Shoes Running Shoes For Women  (Grey),4.4,Women,1049
Walking Shoes For Men  (Green),,Men,914
Women Red Flats Sandal,4,Women,299
"Women Girl's Fashion Trendy Comfortable Slip On Bellies For Women  (Navy, Blue)",4.1,Women,629
Men Brown Sports Sandal,4.2,Men,3495
Punjabi Shoes For Men Jutis For Men  (White),3.8,Men,999
BOOTS Boots For Women  (Black),4.2,Women,999
"Men Brown, Tan Sandal",3.8,Men,1497
Women Grey Flats Sandal,4,Women,799
"Riya-01SportsShoes,WalkingShoes, Casual Running Shoes For Women  (Pink, Grey)",4,Women,999
Women Maroon Flats Sandal,3.3,Women,999
Synthetic Leather Casual Partywear New Design Boots For Women  (Pink),4.2,Women,999
Mesh Casual Stylish Partywear Casaul Shoes For Mens And Boys Sneakers For Men  (Black),3.8,Men,999
"Women's Running Shoes,Walking Shoes Mesh Sports Shoes Walking Shoes For Women  (Navy)",4,Women,499
Slides,4,Men,599
WILLY-2 Bellies For Women  (Red),3.3,Women,425
Women Brown Heels Sandal,3.8,Women,499
Women Black Flats Sandal,,,702
"Sneakers For Women  (White, Pink)",4.4,Women,999
Running Shoes For Women  (Green),4.3,Women,1099
Jutis For Men  (Black),3.8,Men,999
Mojaris For Men  (Gold),3.7,Men,818
Sandoz Running Shoes For Men  (Grey),4.1,Men,599
synthetic Leather Bellies For Women  (Black),4.1,Women,699
Bellies For Women  (Orange),3.9,Women,499
Women Pink Flats Sandal,4,Women,999
Slip On For Men  (Brown),4.2,Men,699
Black Synthetic Leather Casual Loafer Loafers For Men  (Black),4.1,Men,999
"Men's Stylish Loafers For Men  (Red, Black)",3.9,Men,499
by Ruosh 3557-SS17-W01B Corporate Casual For Women  (Brown),4,Women,4990
Sports Mesh Running Shoes For Women  (Green),4,Women,899
"Angel-04 Casual sneakers for ladies | sports shoes for women | Running shoes for girls stylish latest design new fashion | Lace up Lightweight pink shoes for jogging, walking, gym & party Walking Shoes For Women  (Pink)",4.1,Women,999
Slip On Sneakers For Men  (Red),3.9,Men,999
"Sports shoes,Running,partywear,gym shoes Casuals For Men  (Navy)",3.9,Men,999
"Cosko Sports Shoes,Running Shoes,Walking Shoes,Training Shoes, Running Shoes For Men  (Navy, Blue)",4.1,Men,999
Women Beige Heels Sandal,3.9,Women,699
Sparx Women's Sl-158 Sneaker,5,Women,499
Derby For Men  (Brown),4.1,Men,2999
Women Brown Heels Sandal,4,Women,999
RC2282 001 Corporate Casuals For Men  (Black),4.3,Men,2845
Sneakers For Men  (White),4.1,Men,999
Cruxston Wn s MU IDP Running Shoes For Women  (Blue),4.2,Women,3999
Women Multicolor Sports Sandal,4.2,Women,699
Ethics Men's Sports Shoes,3.3,Men,552
"Latest Collection, Comfortable & Fashionable Bellies for Women's and Girl's Pack of 2 Bellies For Women  (Multicolor)",3.7,Women,999
plan flower boots Boots For Women  (Grey),4,Women,1173
Casual Sneakers Shoes For Men Sneakers For Men  (White),4,Men,999
"Totu Womens Black and Red Casual Stylish Comfort ortho High Heel (Pack Of 1) Flip Flops , Size-8 Flip Flops",3.8,Women,499
Boots For Women  (Pink),4.1,Women,999
Slippers,3.6,Women,799
"Latest Stylish Design-Modern Look Casual Moccasins for Women's & Girl's Latest | Fashionable Slip on Loafer, Office-Home Comfort Wear & Lightweight Loafers For Women  (Black)",4.2,Women,999
Sneakers For Women And Girls Sneakers For Women  (Grey),4.1,Women,999
"Mesh,Cricket, Badminton, Volly Ball, Sports Running Shoes For Men  (Black)",3.8,Men,999
Flip Flops,3.8,Men,299
Slippers,3.9,Women,299
Combo Pack of 2 Latest Collection Stylish Sneakers Shoes For Women Sneakers For Women  (Multicolor),4.5,Women,998
Women Red Sports Sandal,4.3,Women,1199
Men Navy Clogs Sandal,3.9,Men,499
Women Maroon Heels Sandal,4,Women,999
Women Pink Bellies Sandal,3.9,Women,699
Slippers,4.1,Men,599
Training & Gym Shoes For Men  (Green),4.2,Men,2049
Women Black Heels Sandal,4,Women,999
Women Grey Heels Sandal,4,Women,999
Women Gold Wedges Sandal,3.7,Women,499
High Heel Canvas Sneakers Casuals For Women  (Red),4.7,Women,999
Casuals For Men  (Grey),4.1,Men,999
Canvas Shoes For Men  (Grey),4,Men,999
"Doctor Extra Soft Slipper Ortho Care Orthopaedic Comfort Dr.Slipper, Flip-Flop and House Slipper for Men's Flip Flops",4.9,Men,799
Flip Flops,3.9,Women,229
"Sports shoes,Running,partywear,gym shoes Casuals For Men  (Navy)",3.9,Men,999
Flip Flops,4.1,Men,499
Sneakers For Women And Girls Sneakers For Women  (Grey),4.1,Women,999
Boots For Women  (Pink),4.1,Women,999
Boots For Women  (Brown),,Women,2990
Bellies For Women  (Black),,,499
Women Navy Flats Sandal,3.7,Women,499
Casual Shoes Loafers For Women  (Black),3.6,Women,499
Mojaris For Men  (Blue),3.2,Men,999
Women Blue Heels Sandal,4,Women,799
Derby For Men  (Black),4.6,Men,2999
Jutis For Women  (Yellow),4.2,Women,799
Women Red Heels Sandal,3.7,Women,840
Lightweight Gymwear Sport Running Shoes For Men Walking Shoes For Men  (Black),3.8,Men,999
Karnaaz Men's Lace-up Casual Sports Sneakers Canvas Shoes,4.2,Men,499
Women Multicolor Flats Sandal,,Women,999
Bellies For Women  (Black),4.3,Women,1690
"Combo Pack of 2 Sports Shoes (Walking Shoes) Outdoors For Men  (Blue, Black)",3.8,Men,998
Jutis For Women  (Pink),3.9,Women,663
Go Run 600-Spectra Running Shoes For Women  (Grey),4.3,Women,5299
Men Orange Sandal,3.6,Men,499
Angel Walking Shoes For Women  (Orange),4.4,Women,1399
Desicolour Punjabi Jutti Belly Mojari Khussa for Party for Women Girls-Zigzag Jutis For Women  (Gold),4.4,Women,1500
Women Beige Wedges Sandal,3.6,Women,999
Women SL-123 Magenta Baby Pink Walking Shoes For Women  (Red),4.3,Women,899
Women Black Heels Sandal,3.4,Women,999
Perfect Stylish Girls Casual Shoes Sneakers For Women  (Pink),4.2,Women,999
Women Green Flats Sandal,4.1,Women,999
Women Beige Flats Sandal,4.7,Women,999
Ankle Length Furr Boot & High Ankle Length Furr Boot Boots For Women  (Tan),4.1,Women,999
GO RUN MOJO-RADAR Running Shoes For Women  (Grey),4.1,Women,5999
Boots For Women  (Black),3.9,Women,999
W Lunar Exceed Tr Training & Gym Shoes For Women  (Black),3.9,Women,6495
Flip Flops,3.8,Men,299
Formal Classy Bellies For Women  (Tan),3.9,Women,500
Designer Attractive Bellies for Womens Girls Jutis For Women  (Multicolor),4.1,Women,599
SF0019L Flip Flops,4.2,Women,269
Flip Flops,4.1,Women,799
Women Brown Wedges Sandal,3.5,Women,2499
0159 Slip On For Men  (Black),3.9,Men,999
Jutis For Women  (Gold),3.7,Women,1895
0224 Slip On For Men  (Black),3.8,Men,999
Slippers,3.9,Women,499
REMO Loafers For Men  (Brown),4.1,Men,999
Women Gold Flats Sandal,4.3,Women,1032
Corporate XI Office Formal shoes Lace Up For Men  (Black),3.7,Men,999
Combo Fitman Grey & Red For Men  (Multicolor),,Men,2499
Men's Blue Velvet Sherwani Jutti Mojaris Party Wear For Men  (Blue),3.6,Men,699
Derby For Men  (Brown),4.1,Men,7499
Women Pink Wedges Sandal,3.9,Women,1599
Women Gold Wedges Sandal,3.8,Women,599
AIRFOAM SOCKS Walking Shoes For Men  (Red),4,Men,999
"Combo Pack of 3 Casual & Sports Shoes (Loafers & Running Shoes) Canvas Shoes For Men  (Blue, Black)",3.8,Men,1497
Walking Shoes For Women  (Navy),4.2,Women,899
Men Beige Casual Sandal,3.8,Men,999
Women Pink Heels Sandal,4.1,Women,999
Sneakers For Women  (Black),4.2,Women,999
Jutis For Men  (Black),3.9,Men,1499
Walking Shoes For Women  (Grey),4.2,Women,999
Women Brown Flats Sandal,3.7,Women,499
Women Grey Flats Sandal,4.3,Women,999
Women Red Heels Sandal,4.3,Women,999
Synthetic Leather Casual Partywear Boots Shoes For Women And Girls Boots For Women  (Pink),4.3,Women,978
Monk Strap For Men  (Black),3.9,Men,999
Top Speed Xtreme Running Shoes For Men  (White),4,Men,2399
"Easywalk-08 Running shoes for boys |sports shoes for men | Latest Stylish Casual sneakers for men | Lace up lightweight black shoes for running, walking, gym, trekking, hiking & party Running Shoes For Men  (Black, Black)",,Men,999
"Molly Bellies For Women  (Pink, Beige)",4.2,Women,1299
Sneakers For Women  (Multicolor),3.5,Women,998
Women Burgundy Flats Sandal,3.9,Women,669
GO WALK 5-SPARROW Walking Shoes For Men  (Black),4.3,Men,4999
Women Off White Flats Sandal,4.1,Women,1029
Jutis For Women  (Multicolor),3.8,Women,499
Lace Up For Men  (Olive),4.1,Men,999
Flip Flops,4,Men,1299
Walking Shoes For Men  (Grey),4,Men,999
Slipper for Men's Flip Flops Slides Home Open Toe Non Slip Brown Slippers,3.8,Men,599
Boots For Mens Boots For Men  (Black),4.1,Men,1456
"Women SL-124 Navy Blue Pink Running Shoes For Women  (Navy, Pink)",4.3,Women,999
Combo Pack of 3 Latest Collection Loafers For Women  (Multicolor),3.9,Women,1497
Girls Stylish Casual Sports Shoe Sneakers For Women  (White),4,Women,999
Women Black Wedges Sandal,3.9,Women,499
"Walking Shoes For Men  (Navy, Grey)",3.9,Men,1299
WF_HF_06 Flip Flops,3.6,Women,399
Girls Stylish Cut Work Design Sneakers For Women  (White),4,Women,499
Women Grey Wedges Sandal,4.1,Women,999
Cilia Mode Leo Sneakers For Women  (Black),4.4,Women,4999
Xyork MU IDP Running Shoes For Men  (Grey),4.2,Men,3999
Women Grey Heels Sandal,4.3,Women,1299
By_Emosis Loafers For Men  (Tan),4,Men,999
Women's | Girls Trendy Lightweight Comfortable Casual wear Lace-Up Shoes Running Shoes For Women  (White),3.9,Women,999
STORMER LS Running Shoes For Women  (Off White),4.3,Women,4076
Women Tan Flats Sandal,4.2,Women,999
Jutis For Women  (Brown),4,Women,699
GLENN W Running Shoes For Women  (Blue),4.3,Women,2499
"Men Black, Green Sports Sandal",4.2,Men,797
"Latest Collection, Comfortable & Fashionable Bellies for Women's and Girl's Pack of 1 Bellies For Women  (Black)",3.9,Women,499
PrasKing Premium White Canvas Casual Sneaker Shoes for Women,3.4,Women,546
Wmns Court Royale Ac Sneakers For Women  (White),4.2,Women,4495
Synthetic Leather Casual Stylish Partywear Boots Shoes For Womens And Girls Boots For Women  (Pink),4.3,Women,999
Women Black Heels Sandal,3.4,Women,799
Men's Black Synthetic Leather Daily Casual Slides,4.1,Men,499
"ZRT049 Training ,walking, gym, sports fast running Running Shoes For Men  (Orange)",4.1,Men,999
Boots For Women  (Grey),4.5,Women,999
Women Black Bellies Sandal,4.2,Women,925
Men Synthetic Leather Chappal (Black) Slippers,3.6,Men,999
Cloe Sneakers For Women  (Multicolor),4.3,Women,1299
For Women  (White),3.9,Women,1299
Imported Dancing shoes Casuals For Men  (Black),3.9,Men,999
"Men SM-482 Olive Yellow Running Shoes For Men  (Olive, Yellow)",4.2,Men,1349
Smash v2 SL one8 Sneakers For Men  (Blue),4.4,Men,3999
Women Black Heels Sandal,4,Women,972
"Mesh Running Shoes, Sports Shoes For Men And Boys? Running Shoes For Men Canvas Shoes For Men Running Shoes For Men  (Grey)",3.6,Men,999
Jutis For Women  (Pink),4,Women,899
Loafers For Men  (Blue),4,Men,499
Slippers,4,Men,1071
Women White Heels Sandal,4.2,Women,999
"Smash Wns BFF P Sneakers For Women  (Black, Pink)",4.3,Women,4999
Cream Handicraft Bellies For Women  (Beige),3.9,Women,900
Cricket Shoes Running Shoes For Men  Running Shoes For Men  (Grey),3.3,Men,999
Casuals For Men  (Orange),3.9,Men,999
Women Maroon Wedges Sandal,4.1,Women,999
TULIP Running Shoes For Women  (Blue),4,Women,899
Slides,3.9,Men,2995
Boxer Black Outdoors For Men  (Black),3.8,Men,499
Sneakers For Women  (Pink),4.2,Women,999
Men Brown Flats Sandal,3.6,Men,1995
"Black Gold Party wear punjabi Party Wear For Women  (Gold, Black)",4.1,Women,599
Dancing Shoes For Men  (Grey),3.9,Men,999
"Women Tan, Tan Flats Sandal",3.8,Women,499
"AADI MEN""S BLACK NEW LOOK FORMAL BROGUES Derby For Men  (Black)",3.9,Men,749
Boots For Women  (Grey),3.8,Women,3599
Wonder Women Flex Lds3 For Women  (Grey),4.2,Women,1599
Women Black Heels Sandal,4.2,Women,999
"Persache Boxer Comfortable Light Wieght Casual, Sneaker & Loafer Shoes, Walking Shoes For Men Sneakers For Men  (Black)",3.4,Men,499
Women Black Sports Sandal,4.1,Women,799
Sneakers For Women  (White),4.8,Women,3999
Running Shoes For Men  (Multicolor),3.9,Men,999
Sneakers For Men  (Grey),3.9,Men,999
Women Brown Flats Sandal,3.9,Women,999
Women Black Heels Sandal,3.8,Women,999
"SM-379 Walking Shoes For Men  (Navy, White)",4.3,Men,1449
Training & Gym Shoes For Women  (Black),4.1,Women,999
Women Purple Flats Sandal,4.1,Women,219
Women Multicolor Wedges Sandal,4,Women,1587
Women Black Heels Sandal,4.1,Women,1799
Men Synthetic Leather Office Black Formal Shoes Slip On For Men  (Black),4,Men,999
"ENVY - MISSTEP Running Shoes For Women  (Black, Grey)",4.5,Women,4499
VERTIGO BLK RUNNING SHOES For MEN 10 Running Shoes For Men  (Black),4.1,Men,2499
"Women-993 Sports Shoes, Running Shoes For Women,Cricket Shoes,Loafers,Sneakers,Casual Shoes,Comfortable For Women'S Sneakers For Women  (White)",3.8,Women,499
Flip Flops,3.7,Women,499
Sneakers For Men  (Black),3.8,Men,499
Women Pink Wedges Sandal,4,Women,499
Men Orange Sandal,,Men,999
Women Black Wedges Sandal,4.2,Women,279
Genuine Leather Formal Ankle Boots For Women  (Black),4.3,Women,5099
Women SL-123 Magenta Baby Pink Walking Shoes For Women  (Red),,,934
Sneakers Sneakers For Men  (Grey),3.9,Men,699
Lace Up For Men  (Black),4,Men,599
Women Casual Boots For Women  (Black),4.2,Women,999
White Sneaker For Men's/Boy's Sneakers For Men  (White),4,Men,449
Slippers,3.9,Women,299
Women Pink Wedges Sandal,4,Women,550
Leather Casual Stylish Look Boots Shoes Boots For Women  (Brown),4.3,Women,955
Women Blue Bellies Sandal,4.2,Women,999
Women's Traditional Ethnic Jutis For Women  (Pink),4,Women,599
Flip Flops,3.9,Women,599
Men Brown Casual Sandal,3.9,Men,3695
NRGY Asteroid Running Shoes For Men  (Blue),4.4,Men,3999
Jutis For Women  (Multicolor),2.2,Women,799
Women Black Wedges Sandal,4.4,Women,899
Ankle Length & High Ankle Length Boots For Women  (Grey),4.1,Women,999
Women Off White Flats Sandal,4,Women,999
"Shinning Stylish Bellies Bellies For Women  (Black, Black)",4.4,Women,599
Jutis For Men  (Black),3.8,Men,999
Women Red Flats Sandal,,Women,699
"Men Tan, Red Flats Sandal",3.7,Men,820
Slippers,4.2,Men,499
Running Shoes For Men  (Blue),4.1,Men,1499
"Women Running, Walking, Sports Shoes For Girls Training & Gym Shoes For Women  (Black)",4.1,Women,749
Men Brown Sandal,3.6,Men,1299
Double Zip Lace Up Boots For Women  (Black),4.3,Women,999
COURTKING2 Badminton Shoes For Men  (White),4.3,Men,1790
Women Black Wedges Sandal,3.9,Women,499
"Running Shoes For Men  (Black, White)",4,Men,2299
Women Silver Heels Sandal,4,Women,499
UNO - STAND ON AIR Sneakers For Women  (White),4.3,Women,5499
Jutis For Women  (Yellow),4.1,Women,499
"Men's Stylish Loafers For Men  (Red, Black)",3.9,Men,499
Training & Gym Shoes For Women  (Black),4.1,Women,999
MODERN JOGGER 2.0 - LOOP Sneakers For Women  (Yellow),3,Women,6499
Genuine Leather Formal Shoes Derby For Men  (Brown),3.9,Men,2999
Stylish and Comfortable Shoes For Man | Casual Office Wear Shoes for Man Lace Up For Men  (Tan),4.2,Men,999
Men Grey Clogs Sandal,3.7,Men,1299
Jutis For Men  (White),3.7,Men,499
WNDR-11 Running Shoes For Men Running Shoes For Men  (Multicolor),3.9,Men,999
"Women SL-165 Violet Grey Walking Shoes For Women  (Purple, Grey)",4.3,Women,999
Women Tan Flats Sandal,3.9,Women,999
Lace Up For Men  (Black),3.9,Men,1749
Nucleus Sneakers For Women  (Multicolor),4.3,Women,5499
Women Pink Wedges Sandal,4.2,Women,999
Slippers,3.8,Men,999
Flip Flops,4,Men,999
Boots For Women  (Brown),4.3,Women,999
Boots For Women  (Black),4.5,Women,5299
New Trendy Fashionable And Comfortable 3 Combo Sneakers Partywear Shoes Casual wear Sneakers For Women And Girls Sneakers For Women  (Multicolor),4,Women,1497
Jutis For Men  (Red),4.7,Men,599
Combo Pack of 2 Latest Collection Stylish casual Sports Running Shoes For Men  (Multicolor),3.4,Men,998
Laser-cut Interlace Bellies For Women  (Grey),4,Women,899
Women Off White Wedges Sandal,4,Women,1299
Running Shoes For Men  (Black),3.6,Men,2399
Men Grey Sandal,,Men,2995
CLAIRE (Collector's Edition) Running Shoes For Women  (Pink),4.4,Women,1299
Jalsa Nagra Jutti Mojaris For Men Mojaris For Men Mocassin For Men Ethnic Mule For Men  (Brown),3.7,Men,999
11031 Loafers For Women  (Blue),3.8,Women,999
Women Navy Sports Sandal,4.3,Women,899
Running Shoes For Men  (Black),4,Men,999
"Walking Shoes For Women  (White, Grey, Black)",4.3,Women,999
Women Black Wedges Sandal,4.2,Women,499
Flip Flops,4,Men,499
Classic Suede Footwear Loafers For Men  (Grey),3.6,Men,999
Comfortable Stylish Latest Design Walking Shoes For Women  (Pink),4.1,Women,999
New Fashionable And Comfortable Sneakers For Women And Girls Party Wear Party Wear For Women  (Pink),4.1,Women,999
Flip Flops,4.3,Women,2295
Walking Shoes For Men  (Multicolor),4,Men,1652
QUICKSPIKE W Walking Shoes For Women  (Yellow),4.3,Women,3799
Slides,3.7,Men,499
"Women SL-165 Navy Blue Pink Walking Shoes For Women  (Navy, Pink)",4.3,Women,999
Zelt Sl 2.0 M Running Shoes For Men  (Grey),4.3,Men,4799
Training & Gym Shoes For Women  (Black),4.4,Women,5995
Men's Golden Wedding & Sherwani Mojaris Mojaris For Men  (Gold),3.7,Men,799
TEMPO Men's Combo Pack of 3 Synthetic Loafers & 2 Sneakers - Multicolour,3.3,Men,999
Turino Stacked Glitter Sneakers For Women  (Silver),4.4,Women,4999
Derby For Men  (Brown),4,Men,999
Perfect Stylish Girls Casual Shoes Sneakers For Women  (Grey),4,Women,499
Bellies For Women  (Grey),4.5,Women,1495
Women Black Wedges Sandal,4.2,Women,279
Flip Flops,3.9,Men,499
Bellies For Women  (Grey),4.1,Women,1299
Latest girl's Boots For Women  (Navy),4.3,Women,999
Bellies For Women  (Blue),3.5,Women,999
Boots For Women  (Brown),4.3,Women,999
Slippers,3.7,Women,699
Women Grey Heels Sandal,3.7,Women,999
Bella Toes Women White Pink Casual Sports Shoes Sneakers_6011,4.1,Women,699
"Women Navy, Beige Sports Sandal",4.3,Women,3795
Derby For Men  (Tan),4.2,Men,5299
Women Grey Flats Sandal,4.1,Women,999
Chevit Men's Casual Shoes (Set of 2 Pairs),3.6,Men,397
"Bxxy Men's Faux Leather Jutti's, Nagra's and Mojari's Jutis For Men  (Green)",3.9,Men,999
Men Brown Flats Sandal,3.7,Men,499
Slip On For Men  (Brown),4,Men,999
Slides,3.7,Women,599
Shoes For Women Boots For Women  (Black),4.2,Women,1167
Men Navy Casual Sandal,4.1,Men,2999
Women Black Wedges Sandal,4.2,Women,279
Women Pink Flats Sandal,4,Women,999
Running Shoes For Men  (Black),3.9,Men,999
Aerobic Dancing Shoes High Tops For Men  (Blue),4,Men,799
TRAVELLAR LP Running Shoes For Men  (White),4.2,Men,2999
Slides,,Women,477
"Women Floral Latest Collection Sneakers Shoes | Casual Style | Trending Shoes for Girl's | Light Weight Breathable Walking, Gym, Yoga",3,Women,335
SL-138 Casuals For Women  (White),4.1,Women,625
Women Silver Flats Sandal,3.9,Women,730
"Comfort Training Shoes,Walking Shoes,Gym Shoes,Sports Shoes Running Shoes For Men  (Yellow)",4.1,Men,999
"Men Brown, Olive Casual Sandal",4.2,Men,699
Casuals For Men  (Red),3.8,Men,549
Women Gold Wedges Sandal,3.2,Women,499
"Mesh,Cricket, Badminton, Volly Ball, Sports Running Shoes For Men  (Blue)",3.8,Men,999
BATA Women's Casual Soft Sneakers,4.2,Women,449
PRO-CAP-AW1017 Lace Up For Men  (Brown),4,Men,1499
Walking Shoes For Men  (White),3.9,Men,999
Running Shoes For Men  (Red),4.1,Men,942
Women Casual Boots For Girls Boots For Women  (Black),4.4,Women,999
Ladies New Formal Shoes Slip On For Women  (Black),,Women,999
Boots For Women  (Tan),4.2,Women,1499
Running Shoes For Men  (Blue),4.1,Men,1499
IGNITE Contender Knit Running Shoes For Men  (Blue),4.7,Men,6499
casual for men sneaker shoes high top shoes stylish High Tops For Men  (Blue),4.1,Men,999
Women Beige Flats Sandal,4.1,Women,999
Boots For Women  (Pink),4.2,Women,999
Women Black Flats Sandal,3.9,Women,999
Trendy Look for Jeans and Kurta Pajama /Artificial Leather Ethnic Shoes For Men Ethnic Mule For Men  (Black),4.1,Men,999
Men Brown Sandal,4.1,Men,1850
"New Trendy, Stylish , Girl's High Heel , Comfortable and Fashionble ,Out Door , Boot Shoe's For Women/Girls , Ankle Length , LightWeight , Lace Up Casual , Boot For Women/Girls Boots For Women  (Black)",4.3,Women,1599
Longwalk Women Casual Wear Sneakers Shoes Pack of 1,4.1,Women,299
Outdoors For Men  (Tan),3.5,Men,1595
WILLY-2 Bellies For Women  (Red),3.3,Women,499
Casuals For Men  (Black),3.6,Men,962
Chevit Men's Casual Shoes (Set of 2 Pairs),3.6,Men,397
SL 164 Walking Shoes For Women  (Blue),4.4,Women,999
Women Maroon Wedges Sandal,4,Women,999
Perfect Stylish Girls Casual Shoes Sneakers For Women  (Pink),4.3,Women,999
Womens Comfort Stylish Trending Printed Slippers (Pack Of 4) Flip Flops,3.8,Women,499
Slip On For Men  (Brown),4.2,Men,699
Women Black Heels Sandal,3.4,Women,799
Women Black Heels Sandal,3.9,Women,850
Men Multicolor Sandal,3.9,Men,998
"445 Sports Shoes (Walking & Gym Shoes) Running Shoes For Men  (White, Blue)",3.8,Men,499
Men Brown Casual Sandal,4.3,Men,1999
Hello Kitty Adult Home Slippers Slippers,4.2,Women,1200
Women Pink Heels Sandal,4.1,Women,999
NIKE CHROMA THONG 5 Slippers,4.2,Men,1495
Stylish Boots for mens Casuals For Men  (Brown),4.1,Men,999
Loafers For Women  (Yellow),4,Women,999
